{
  "schema_version": "rpnh/shared-harness-local-validation-return/v1",
  "package_name": "RPNH_Shared_Harness_Local_Validation_20261008",
  "validated_at_utc": "2026-10-08T15:23:39.500154+00:00",
  "source": {
    "tested_base_commit": "c545621c30452650202ad0aca2bc023b6956929b",
    "initial_head": "80a17c3ce45ec3c7a1b39c170c36bbb922276de1",
    "initial_dirty_status": "",
    "final_dirty_status": " M cpn/components/agent_loop/optional_host_bindings.py\n M cpn/rpnh/collaboration/environment_host.py\n M cpn/rpnh/registry/_event_store/collaboration_descriptors.py\n M cpn/rpnh/registry/object_store.py\n M cpn/rpnh/registry/run_authority.py\n M docs/ARCHITECTURE.md\n M docs/ARCHITECTURE_ZH.md\n M examples/harnessaudit_office/README.md\n M examples/harnessaudit_office/README_ZH.md\n M examples/harnessaudit_office/src/rpnh_ha/recovery.py\n M examples/harnessaudit_office/src/rpnh_ha/registry_export.py\n M tests/test_package_result_projection.py\n M tests/test_workspace_write_atomicity.py\n?? examples/harnessaudit_office/tests/test_registry_reader_consumers.py\n?? examples/harnessaudit_office/tests/test_terminal_identity.py\n?? tests/test_optional_output_guidance.py\n?? tests/test_run_descriptor_reads.py\n",
    "file_manifest_path": "cloud-handoff/file_manifest.json",
    "baseline_matches": true,
    "patched_hashes_match": true,
    "current_head_compatibility": "Product fast-forwarded documentation only to exact tested c545621 baseline; all 17 applied main files byte-equal isolated tested worktree. Validation snapshot precedes authorized GitHub delivery."
  },
  "environment": {
    "os": "Linux-6.6.87.2-microsoft-standard-WSL2-x86_64-with-glibc2.39",
    "python": "3.13.12 | packaged by conda-forge | (main, Feb  5 2026, 05:53:46) [GCC 14.3.0]",
    "pytest": "8.4.2",
    "native_socket_supported": true,
    "checkout_local_label": "isolated exact baseline plus frozen A/B",
    "dependencies": [
      "pytest==8.4.2",
      "jsonschema==4.26.0",
      "packaging==26.3",
      "websockets==15.0.1",
      "numpy==2.4.3",
      "scipy==1.17.1"
    ]
  },
  "A": {
    "status": "BLOCKED_ENV",
    "patch_sha256": "61f2f7115306b8c39846d34e77918c31ae4ccf9f62c0a8835a661c7124400137",
    "cases": [
      {
        "id": "A_targeted_registry_and_consumers_242",
        "status": "BLOCKED_ENV",
        "summary": "Actual pytest 241 passed / 1 failed / 0 skipped; one unchanged ownership guard environment blocker. Ordinary WSL retry fails before pytest at AF_VSOCK setup. No transport/permission/guard bypass.",
        "evidence_paths": [
          "local/logs/A-offline.xml",
          "local/logs/A-offline.stdout.log",
          "local/environment-blocker.json"
        ],
        "command": "<WORKSPACE>/.p26/v/bin/python -B -m pytest -q examples/harnessaudit_office/tests tests/test_package_result_projection.py tests/test_object_store_streaming.py tests/test_package_result_delivery.py tests/test_run_descriptor_reads.py tests/test_registry_read_session.py tests/test_module_graph_projection.py --disable-warnings --basetemp=<WORKSPACE>/.h26/a --junitxml=<WORKSPACE>/task-shared-harness-validation-20261008/logs/A-offline.xml -p no:cacheprovider",
        "exit_code": 1,
        "passed": 241,
        "failed": 1,
        "skipped": 0
      },
      {
        "id": "A_current_authority_and_expected_refs",
        "status": "PASS",
        "summary": "Passed in the exact frozen local targeted suite; source and test identities retained.",
        "evidence_paths": [
          "local/logs/A-offline.xml",
          "local/offline-test-inventory.json"
        ],
        "command": "<WORKSPACE>/.p26/v/bin/python -B -m pytest -q examples/harnessaudit_office/tests tests/test_package_result_projection.py tests/test_object_store_streaming.py tests/test_package_result_delivery.py tests/test_run_descriptor_reads.py tests/test_registry_read_session.py tests/test_module_graph_projection.py --disable-warnings --basetemp=<WORKSPACE>/.h26/a --junitxml=<WORKSPACE>/task-shared-harness-validation-20261008/logs/A-offline.xml -p no:cacheprovider",
        "exit_code": 0
      },
      {
        "id": "A_historical_generation_and_active_states",
        "status": "PASS",
        "summary": "Passed in the exact frozen local targeted suite; source and test identities retained.",
        "evidence_paths": [
          "local/logs/A-offline.xml",
          "local/offline-test-inventory.json"
        ],
        "command": "<WORKSPACE>/.p26/v/bin/python -B -m pytest -q examples/harnessaudit_office/tests tests/test_package_result_projection.py tests/test_object_store_streaming.py tests/test_package_result_delivery.py tests/test_run_descriptor_reads.py tests/test_registry_read_session.py tests/test_module_graph_projection.py --disable-warnings --basetemp=<WORKSPACE>/.h26/a --junitxml=<WORKSPACE>/task-shared-harness-validation-20261008/logs/A-offline.xml -p no:cacheprovider",
        "exit_code": 0
      },
      {
        "id": "A_same_cut_each_consumer_identity_agreement",
        "status": "PASS",
        "summary": "Real native managed run: distinct core-bound consumer cuts select identical exact terminal/result; head893/epoch2/268objects unchanged; no new owner or writer in read phase.",
        "evidence_paths": [
          "local/probes/A/native-observations.json",
          "local/probes/A/read-only-observations.json",
          "local/probes/A/consumers.xml"
        ],
        "command": "<WORKSPACE>/.p26/v/bin/python -B -m pytest -q examples/harnessaudit_office/tests tests/test_package_result_projection.py tests/test_object_store_streaming.py tests/test_package_result_delivery.py tests/test_run_descriptor_reads.py tests/test_registry_read_session.py tests/test_module_graph_projection.py --disable-warnings --basetemp=<WORKSPACE>/.h26/a --junitxml=<WORKSPACE>/task-shared-harness-validation-20261008/logs/A-offline.xml -p no:cacheprovider",
        "exit_code": 0
      },
      {
        "id": "A_cross_core_wrong_kernel_historical_view_rejected",
        "status": "PASS",
        "summary": "Passed in the exact frozen local targeted suite; source and test identities retained.",
        "evidence_paths": [
          "local/logs/A-offline.xml",
          "local/offline-test-inventory.json"
        ],
        "command": "<WORKSPACE>/.p26/v/bin/python -B -m pytest -q examples/harnessaudit_office/tests tests/test_package_result_projection.py tests/test_object_store_streaming.py tests/test_package_result_delivery.py tests/test_run_descriptor_reads.py tests/test_registry_read_session.py tests/test_module_graph_projection.py --disable-warnings --basetemp=<WORKSPACE>/.h26/a --junitxml=<WORKSPACE>/task-shared-harness-validation-20261008/logs/A-offline.xml -p no:cacheprovider",
        "exit_code": 0
      },
      {
        "id": "A_fresh_net_and_resumed_no_publication",
        "status": "PASS",
        "summary": "Passed in the exact frozen local targeted suite; source and test identities retained.",
        "evidence_paths": [
          "local/logs/A-offline.xml",
          "local/offline-test-inventory.json"
        ],
        "command": "<WORKSPACE>/.p26/v/bin/python -B -m pytest -q examples/harnessaudit_office/tests tests/test_package_result_projection.py tests/test_object_store_streaming.py tests/test_package_result_delivery.py tests/test_run_descriptor_reads.py tests/test_registry_read_session.py tests/test_module_graph_projection.py --disable-warnings --basetemp=<WORKSPACE>/.h26/a --junitxml=<WORKSPACE>/task-shared-harness-validation-20261008/logs/A-offline.xml -p no:cacheprovider",
        "exit_code": 0
      },
      {
        "id": "A_environment_none_is_delivery_shortcircuit",
        "status": "PASS",
        "summary": "Passed in the exact frozen local targeted suite; source and test identities retained.",
        "evidence_paths": [
          "local/logs/A-offline.xml",
          "local/offline-test-inventory.json"
        ],
        "command": "<WORKSPACE>/.p26/v/bin/python -B -m pytest -q examples/harnessaudit_office/tests tests/test_package_result_projection.py tests/test_object_store_streaming.py tests/test_package_result_delivery.py tests/test_run_descriptor_reads.py tests/test_registry_read_session.py tests/test_module_graph_projection.py --disable-warnings --basetemp=<WORKSPACE>/.h26/a --junitxml=<WORKSPACE>/task-shared-harness-validation-20261008/logs/A-offline.xml -p no:cacheprovider",
        "exit_code": 0
      },
      {
        "id": "A_strict_descriptor_and_physical_bounds",
        "status": "PASS",
        "summary": "Passed in the exact frozen local targeted suite; source and test identities retained.",
        "evidence_paths": [
          "local/logs/A-offline.xml",
          "local/offline-test-inventory.json"
        ],
        "command": "<WORKSPACE>/.p26/v/bin/python -B -m pytest -q examples/harnessaudit_office/tests tests/test_package_result_projection.py tests/test_object_store_streaming.py tests/test_package_result_delivery.py tests/test_run_descriptor_reads.py tests/test_registry_read_session.py tests/test_module_graph_projection.py --disable-warnings --basetemp=<WORKSPACE>/.h26/a --junitxml=<WORKSPACE>/task-shared-harness-validation-20261008/logs/A-offline.xml -p no:cacheprovider",
        "exit_code": 0
      },
      {
        "id": "A_native_resource_provenance",
        "status": "PASS",
        "summary": "Passed in the exact frozen local targeted suite; source and test identities retained.",
        "evidence_paths": [
          "local/logs/A-offline.xml",
          "local/offline-test-inventory.json"
        ],